{"$id":"https://moving-origin-research.invalid/schemas/m4-phase-a-transcript-v1","$schema":"https://json-schema.org/draft/2020-12/schema","additionalProperties":false,"properties":{"abstention_score":{"maximum":1,"minimum":0,"type":"number"},"candidate_self_state_vector":{"items":{"type":"number"},"type":"array"},"checkpoint_identity_sha256":{"pattern":"^[0-9a-f]{64}$"},"confidence":{"maximum":1,"minimum":0,"type":"number"},"configuration_sha256":{"pattern":"^[0-9a-f]{64}$"},"date":{"const":"2026-08-21"},"end_offset_ns":{"minimum":0,"type":"integer"},"episode_ordinal":{"minimum":0,"type":"integer"},"generated_text":{"type":"string"},"generated_token_ids":{"items":{"minimum":0,"type":"integer"},"type":"array"},"option_logits":{"items":{"type":"number"},"minItems":2,"type":"array"},"oracle_correct":{"type":"boolean"},"oracle_label":{"type":"string"},"peer_projection_order":{"const":["seed_ordinal","episode_ordinal","request_ordinal","rendered_prompt","public_input_projection","generated_token_ids","generated_text","option_logits","confidence","abstention_score","start_offset_ns","end_offset_ns","oracle_label","oracle_correct","response_sha256"]},"peer_projection_sha256":{"pattern":"^[0-9a-f]{64}$"},"public_input_projection":{"additionalProperties":false,"properties":{"history_sha256":{"pattern":"^[0-9a-f]{64}$"},"input_text":{"type":"string"},"option_labels":{"items":{"type":"string"},"minItems":2,"type":"array"}},"required":["input_text","option_labels","history_sha256"],"type":"object"},"regime":{"const":"B"},"rendered_prompt":{"type":"string"},"request_ordinal":{"minimum":0,"type":"integer"},"response_sha256":{"pattern":"^[0-9a-f]{64}$"},"rung_id":{"enum":["PRIMARY_QWEN3_4B_FP8","FALLBACK_QWEN3_8B_FP8"]},"schema_version":{"const":"m4-phase-a-transcript-v1"},"seed_ordinal":{"enum":[101,102,103,104,105]},"start_offset_ns":{"minimum":0,"type":"integer"}},"required":["schema_version","date","regime","rung_id","checkpoint_identity_sha256","configuration_sha256","seed_ordinal","episode_ordinal","request_ordinal","rendered_prompt","public_input_projection","generated_token_ids","generated_text","option_logits","confidence","abstention_score","candidate_self_state_vector","start_offset_ns","end_offset_ns","oracle_label","oracle_correct","response_sha256","peer_projection_order","peer_projection_sha256"],"title":"M4 Phase A transcript record v1","type":"object","x-artifact-date":"2026-08-21","x-artifact-regime":"B","x-source-class":"PROPOSED"}
