{"abstention_score":0.2,"candidate_self_state_vector":[0.25,0.75],"checkpoint_identity_sha256":"0000000000000000000000000000000000000000000000000000000000000000","confidence":0.8,"configuration_sha256":"0000000000000000000000000000000000000000000000000000000000000000","date":"2026-08-21","end_offset_ns":20,"episode_ordinal":0,"generated_text":"A","generated_token_ids":[32],"option_logits":[2,1],"oracle_correct":true,"oracle_label":"A","peer_projection_order":["seed_ordinal","episode_ordinal","request_ordinal","rendered_prompt","public_input_projection","generated_token_ids","generated_text","option_logits","confidence","abstention_score","start_offset_ns","end_offset_ns","oracle_label","oracle_correct","response_sha256"],"peer_projection_sha256":"0000000000000000000000000000000000000000000000000000000000000000","public_input_projection":{"history_sha256":"0000000000000000000000000000000000000000000000000000000000000000","input_text":"fixture input","option_labels":["A","B"]},"regime":"B","rendered_prompt":"fixture prompt","request_ordinal":0,"response_sha256":"0000000000000000000000000000000000000000000000000000000000000000","rung_id":"PRIMARY_QWEN3_4B_FP8","schema_version":"m4-phase-a-transcript-v1","seed_ordinal":101,"start_offset_ns":10}
